{
  "schemaVersion": 1,
  "jobId": "job-rollback-example",
  "runId": "run-rollback-example",
  "bindingId": "main-screen",
  "createdAt": "2026-09-17T03:00:00Z",
  "operation": "rollback",
  "target": {
    "fileKey": "replace-locally",
    "fileName": "Sample UI",
    "pageId": "1:1",
    "pageName": "Main",
    "nodeIds": ["2:1"],
    "preconditionHash": "replace-with-failed-run-after-hash"
  },
  "capabilities": ["read", "write"],
  "risk": {
    "level": "high",
    "reasons": ["rollback-may-affect-user-work"],
    "confirmationRequired": true,
    "confirmation": {
      "confirmedBy": "user",
      "confirmedAt": "2026-09-17T03:00:00Z",
      "scopeHash": "replace-with-confirmed-scope-hash"
    }
  },
  "options": {
    "allowDelete": false,
    "fullText": false,
    "previewScale": 1
  },
  "timeoutMs": 30000
}
